{"schemaVersion":"dromio.browser-operation.v1","requestId":"request-1","operationId":"browser.page.navigate","scope":{"tenantId":"tenant-1","applicationId":"app-1","userId":"user-1","threadId":"thread-1"},"effectClass":"lifecycle","permissionClass":"browser.interact","approval":"automatic","recovery":"safe-retry","input":{"url":"https://example.test"}}
